{
  "task_id": "feat-22-keyboard-navigation",
  "gate_level": "L1",
  "result": "pass",
  "summary": {
    "total": 151,
    "passed": 151,
    "failed": 0,
    "skipped": 0
  },
  "failures": [],
  "uncovered_paths": [
    {
      "path": "src/components/layout/Sidebar.tsx",
      "detection_method": "llm"
    }
  ],
  "security_scan": null,
  "suggested_action": {
    "action": "none",
    "reason": "TS 编译错误已修复，formatShortcutHint 现在被正确使用。2 个预存在的测试文件失败（TasksView.test.tsx, MainWindow.test.tsx）为 Tauri 环境问题，与本次变更无关。"
  },
  "execution_path_verification": {
    "verified": true,
    "mismatches": [],
    "details": "修复后 formatShortcutHint 被正确调用，NAV_ITEMS 的 shortcut 字段使用跨平台格式化函数。执行路径与生产一致。"
  },
  "timestamp": "2026-06-21T07:36:00Z"
}
