{
  "task_id": "refactor-db-path",
  "gate_level": "L1",
  "result": "pass",
  "summary": {
    "total": 24,
    "passed": 24,
    "failed": 0,
    "skipped": 0
  },
  "failures": [],
  "uncovered_paths": [],
  "security_scan": {
    "h1_dependency_audit": {
      "vulnerabilities_found": 0,
      "critical": 0,
      "high": 0,
      "details": [
        "cargo audit: 0 critical, 0 high vulnerabilities",
        "18 allowed warnings (unmaintained gtk-rs, proc-macro-error, unic-*) — all pre-existing, unrelated to db.rs changes",
        "Path injection: resolve_custom_path rejects '..' segments, HOME empty check returns Err, tilde expansion limited to single substitution",
        "Error handling: all init functions return Result, create_dir_all errors propagated, no expect/panic in changed code"
      ]
    },
    "h2_secret_scan": {
      "secrets_found": 0,
      "details": [
        "Scanned db.rs, events.rs, audit.rs, mod.rs, lib.rs — no hardcoded secrets, API keys, private keys, or credentials",
        "api_key references in events.rs read from runtime config, not hardcoded"
      ]
    }
  },
  "timestamp": "2026-06-13T16:30:00Z"
}
